{"$schema": "https://json-schema.org/draft/2020-12/schema", "title": "routines/*.json", "type": "object", "required": ["name", "schedule"], "anyOf": [{"required": ["prompt"]}, {"required": ["steps"]}, {"required": ["stepsFile"]}], "properties": {"name": {"type": "string"}, "prompt": {"type": "string", "description": "Legacy: full saved prompt. 0.9.2+: the live prompt is the rendered thin routine prompt (routines/<name>.prompt.md); real instructions go in steps/stepsFile."}, "steps": {"oneOf": [{"type": "string"}, {"type": "array", "items": {"type": "string"}}], "description": "The routine's real instructions (0.9.2+)."}, "stepsFile": {"type": "string", "description": "Optional path (repo-relative, under bots/<slug>/) to a markdown file with the steps (0.9.2+)."}, "schedule": {"type": "string", "description": "cron or plain-language schedule"}, "timezone": {"type": "string"}, "status": {"enum": ["active", "paused"]}, "enabled": {"type": "boolean"}, "private": {"type": "boolean", "description": "0.10.2: confidential steps. Name must start with private-; steps live in a git-ignored routines/private-<name>.steps.md (stepsFile)."}}}
